<?xml version="1.0" encoding="utf-8"?>
<xs:schema xmlns:xs="http://www.w3.org/2001/XMLSchema">
  <xs:element name="users">
    <xs:complexType>
      <xs:sequence>
        <xs:element name="user" maxOccurs="unbounded" minOccurs="0">
          <xs:complexType>
            <xs:sequence>
              <xs:element name="name">
                <xs:complexType>
                  <xs:sequence>
                    <xs:element type="xs:string" name="username"/>
                    <xs:element type="xs:string" name="firstname"/>
                    <xs:element type="xs:string" name="middlename" minOccurs="0"/>
                    <xs:element type="xs:string" name="lastname"/>
                  </xs:sequence>
                </xs:complexType>
              </xs:element>
              <xs:element type="xs:dateTime" name="firstlogindate"/>
              <xs:element type="xs:dateTime" name="lastlogindate"/>
              <xs:element type="xs:string" name="email"/>
              <xs:element type="xs:anyURI" name="avatar"/>
              <xs:element type="xs:string" name="password"/>
            </xs:sequence>
            <xs:attribute name="id" use="required">
              <xs:simpleType>
                <xs:restriction base="xs:string">
                  <xs:pattern value="[a-z][0-9]{4}"/>
                </xs:restriction>
              </xs:simpleType>
            </xs:attribute>
            <xs:attribute name="type" use="required">
              <xs:simpleType>
                <xs:restriction base="xs:string">
                  <xs:pattern value="client|admin"/>
                </xs:restriction>
              </xs:simpleType>
            </xs:attribute>
          </xs:complexType>
        </xs:element>
      </xs:sequence>
    </xs:complexType>
  </xs:element>
</xs:schema>